,Transcription
clip91,who appear to have tremendous self-control it turns out those individuals aren't all that different from those who are struggling instead discipline people are better at structuring their lives in a way that does not require heroic willpower and self-control in other words they simply spend less time in tempting situations the people with the best self-control are typically the ones who need to use it the least it's easier to practice self-restraint when you don't have to use it very often so yes perseverance grit and willpower are essential to success but the way to improve these qualities is not by wishing you were more disciplined person but by creating a more disciplined environment this counterintuitive idea
Pride,one thing to say I'm the type of person who wants this it's something very different to say I'm the type of person who is this the more Pride you have in a particular aspect of your identity the more motivated you will be to maintain the habits associated with it if you're proud of how your hair looks you'll develop all sorts of habits to care for and maintained it if you're proud of the size of your biceps you'll make sure you never skip an upper-body workout if you're proud of the scarves unit you'll be more likely to spend hours knitting each week once your pride gets involved you'll fight tooth-and-nail to maintain your habits true Behavior change is identity change you might start a habit because of motivation but the only reason
Increasing speed of punishment a la Roger Fisher and nuclear codes,the more immediate and more costly mistake is the faster you will learn from it the threat of a bad review forces a plumber to be good at this job the possibility of a customer never returning makes restaurants create good food the cost of cutting the wrong blood vessel makes a surgeon Master human anatomy and cut carefully when the consequences are severe people learn quickly the more immediate the pain the less likely the behavior if you want to prevent bad habits and eliminate unhealthy behaviors than adding an instant cost to the action is a great way to reduce their odds we repeat bad habits because they serve Us in some way and that makes them hard to abandon
clip6,path followed between any two points will always be the path requiring the least amount of energy this simple principle underpins the laws of the universe in from this one idea you can describe the laws of motion and relativity in any case people are wired to do what is convenient for example expanding your farm to the east where you can grow the same crops rather than heading north where the climate is different out of all the possible actions we could take the one that is realized is the one that delivers the most value for the least effort we are motivated to do what is easy every action requires a certain amount of energy the more energy required the less likely it is to occur if you're
Qol,forgive me if this sounds boastful to be honest there was nothing legendary or historic about my athletic career I never ended up playing professionally however looking back on those years I believe I accomplished something just as rare I fulfilled my potential and I believe the concepts in this book can help you fulfill your potential as well we all face challenges in life this injury was one of mine and the experience taught me a critical lesson changes that seem small and unimportant first will compound into remarkable results if you're willing to stick with them for years we all deal with setbacks but in the long run the quality of Our Lives often depends on the quality of our habits
Belonging to the tribe,New York City runs a company called nerd Fitness according to their motto they help nerds Misfits and mutants lose weight get strong and get healthy his clients include videogame lovers movie Fanatics and Average Joes who want to get in shape many people feel out of place the first time they go to the gym or try to change their diet but if you are already similar to the other members of the group in some way say your mutual love of Star Wars change becomes more appealing because it feels like something people like you already do nothing sustains motivation better than belong to the tribe it transforms a personal Quest into a shared one previously you were on
Prove with small wins,majority of the time new identities require new evidence if you keep casting the same boats you've always cast you're going to keep getting the same results you've always had it nothing changes nothing is going to change it is a simple two-step process one decide the type of person you want to be to prove it to yourself with small wins first decide who you want to be this holds at any level as an individual as a team as a community as a nation what do you want to stand for what are your principles and values who do you wish to become these are Big questions
Crop geography,this massive stretch of land tends to be more East-West and shape according to Diamond this difference in shape play the significant role in the spread of Agriculture over the centuries when agriculture began to spread around the globe Farmers had an easier time expanding along East-West routes then along north-south ones this is because locations along the same latitude generally share similar climates amount of sunlight and rainfall and changes and season these factors allow farmers in Europe and Asia to domesticate a few crops and grow them along the entire stretch of land from France to China by comparison the climate vary
Starting small,the more energy required the less likely it is to occur if your goal is to do 100 push-ups Verde well that's a lot of energy in the beginning when you're motivated and excited you can muster the strength to get started but after a few days such a massive effort feels exhausting mean while sticking to the habit of doing one pushup per day requires almost no energy to get started and the less energy I have it requires the more likely it is to occur look at any behavior that fills up much of your life and you'll see that it can be performed with very low levels of motivation have it's like scrolling on our phones checking email and watching television steal so much of our time
Never miss twice,spending your time that said every habits weekends at some point and more important than any single measurement is having a good plan for when your habits slide off track how to recover quickly when your habits break down no matter how consistent you are with your habits it is inevitable that life will interrupt you with some point Perfection is not possible before long an emergency will pop up you'll get sick or you have to travel for work or your family needs a little more of your time whenever this happens to me I try to remind myself of a simple rule never missed twice if I miss one day I try to get back into it as quickly as possible missing one
Short term awards that align with your goals,loyalty program for yourself the immediate reward of seeing yourself save money toward the leather jacket feels a lot better than just being deprived you are making it satisfying to do nothing one of my readers and his wife used a similar setup they wanted to stop eating out so much and start cooking more together they labeled their savings account trip to Europe whenever they skipped going out to eat they transferred $50 into the account at the end of the year they put the money for the vacation it is worth noting that is important to select short-term rewards that reinforce your identity rather than ones that conflict with it buying a new jacket is fine if you're trying to lose weight or read more books but it doesn't work
Bad habits,the long-term ones behavioral Economist refer to this tendency has timing consistency that is the way your brain evaluates rewards is inconsistent across time you value the present more than the future usually this tendency serves as well a reward that a certain right now is typically worth more than one that is merely possible in the future but occasionally are biased toward instant gratification causes problems why would someone smoke if they know what increases the risk of lung cancer why would someone over eat if they know it increases their risk of obesity why would someone have unsafe sex if they know it can result in sexually transmitted disease once you understand how the
Rewrite the game,says everyone has at least a few areas in which they could be in the top 25% with some effort in my case I can draw better than most people but I'm hardly an artist and I'm not any funnier than the average stand up comedian who never makes a big but I'm funnier than most people the magic is that few people can draw well and dry jokes it's the combination of the two that makes what I do so rare and when you add in my business background suddenly I have a topic that Pew cartoonist could hope to understand without living it when you can't win by being better you can win by being different by combining your skills you reduce the level of competition which makes it easier to stand out
clip53,path followed between any two points will always be the path requiring the least amount of energy this simple principle underpins the laws of the universe in from this one idea you can describe the laws of motion and relativity in any case people are wired to do what is convenient for example expanding your farm to the east where you can grow the same crops rather than heading north where the climate is different out of all the possible actions we could take the one that is realized is the one that delivers the most value for the least effort we are motivated to do what is easy every action requires a certain amount of energy the more energy required the less likely it is to occur if you're
Awareness,an acknowledged the cues that trigger them which makes it possible to respond in a way that benefits you chapter summary with enough practice your brain will pick up on the q's that predict certain outcomes without consciously thinking about it once our habits become automatic we stopped paying attention to what we are doing the process of behavior change always starts with awareness you need to be aware of your habits before you can change them pointing and calling raises your level of awareness from an unconscious Habit to a more conscious level by verbalizing your actions The Habit scorecard is a simple exercise you can use to become more aware of your behavior
